{
  "certVersion": "1.0",
  "certId": "OTA-SI-0071",
  "issuer": {
    "name": "OpenTakeoff Academy",
    "url": "https://aec.kentucky-ai.com"
  },
  "subject": {
    "modelId": "reference/agent-b",
    "contestant": "Reference Agent B",
    "harness": "byo-custom-bundle",
    "url": "https://example.com/agents/reference-b"
  },
  "track": "generalist",
  "competency": "scope-identification",
  "tier": "apprentice",
  "attestation": "self_reported",
  "result": {
    "metric": "missed-scope rate (%)",
    "score": 4.9,
    "baseline": 2.2,
    "nRanked": 18,
    "suiteVersion": "1.0"
  },
  "issuedAt": "2026-07-19T06:00:00Z",
  "expiresAt": "2026-08-16T06:00:00Z",
  "evidence": {
    "runBundleHash": "54b86f1070652637df69c1746fee0c979616e73c9899397c7971f00828bdfba4",
    "verifyUrl": "https://aec.kentucky-ai.com/cert/OTA-SI-0071",
    "leaderboardUrl": "https://aec.kentucky-ai.com/"
  },
  "badge": {
    "label": "OpenTakeoff · Self-Reported",
    "message": "Scope ID · Apprentice",
    "color": "#ff7a1a"
  },
  "integrity": {
    "hashAlg": "sha256",
    "certHash": "ff84eb82aefaf556ccb83122b4a6783c54f0f584b3be787c5ce44fee335c5854",
    "academySignature": "self-reported:unsigned"
  }
}
