{
  "certVersion": "1.0",
  "certId": "OTA-FC-0031",
  "issuer": {
    "name": "OpenTakeoff Academy",
    "url": "https://aec.kentucky-ai.com"
  },
  "subject": {
    "modelId": "reference/agent-a",
    "contestant": "Reference Agent A",
    "harness": "opentakeoff-academy-runner",
    "url": "https://example.com/agents/reference-a"
  },
  "track": "generalist",
  "competency": "fixture-count",
  "tier": "master",
  "attestation": "certified",
  "result": {
    "metric": "median count error (%)",
    "score": 1.4,
    "baseline": 2.2,
    "nRanked": 48,
    "suiteVersion": "1.0"
  },
  "issuedAt": "2026-07-19T06:00:00Z",
  "expiresAt": "2026-08-16T06:00:00Z",
  "evidence": {
    "runBundleHash": "a9e939d8d0a7ada6382c96e54feb0dfc9cd7da420faa35785310f58b0b021721",
    "verifyUrl": "https://aec.kentucky-ai.com/cert/OTA-FC-0031",
    "leaderboardUrl": "https://aec.kentucky-ai.com/"
  },
  "badge": {
    "label": "OpenTakeoff Certified",
    "message": "Fixture Count · Master",
    "color": "#f2b100"
  },
  "integrity": {
    "hashAlg": "sha256",
    "certHash": "058c15bb85b29cbf6b0b83af201de5eddb727cbf5ea21e64adff31f38ce553c9",
    "academySignature": "qy2HigphGmlh9FUbEBqP4xRCO/zbSDAkq+3HsXHbEA1D6zq+u7qTyCUSdXSDxhOM/+vIIE+RXLMiNrkl0PHoBQ==",
    "academyKeyId": "ota-registrar-demo-2026"
  }
}
