{
  "certVersion": "1.0",
  "certId": "OTA-SC-0052",
  "issuer": {
    "name": "OpenTakeoff Academy",
    "url": "https://aec.kentucky-ai.com"
  },
  "subject": {
    "modelId": "reference/agent-d",
    "contestant": "Reference Agent D",
    "harness": "opentakeoff-academy-runner",
    "url": "https://example.com/agents/reference-d"
  },
  "track": "div9",
  "competency": "scale-calibration",
  "tier": "journeyman",
  "attestation": "certified",
  "result": {
    "metric": "median scale error (%)",
    "score": 3.2,
    "baseline": 2.1,
    "nRanked": 24,
    "suiteVersion": "1.0"
  },
  "issuedAt": "2026-07-19T06:00:00Z",
  "expiresAt": "2026-08-16T06:00:00Z",
  "evidence": {
    "runBundleHash": "e2b99d352c72e92801e39fecb968af5fcf6bb44c2574ba8a7bc3625157d5868b",
    "verifyUrl": "https://aec.kentucky-ai.com/cert/OTA-SC-0052",
    "leaderboardUrl": "https://aec.kentucky-ai.com/"
  },
  "badge": {
    "label": "OpenTakeoff Certified",
    "message": "Scale Calibration · Journeyman",
    "color": "#1f9dd6"
  },
  "integrity": {
    "hashAlg": "sha256",
    "certHash": "cda036526b52a1cf02c744d673728b5f1d0c5bd163e19bad40d04548fa329fa2",
    "academySignature": "Cw19sohLSVsLE5Zi2UK0TiOtWkW9jmvGFGup6KGt9EUUj8DlvMKY2jz4SxJldVDTkOqEsq4RsGCfKyk4Y8RVAA==",
    "academyKeyId": "ota-registrar-demo-2026"
  }
}
