{
  "certVersion": "1.0",
  "certId": "OTA-SI-0044",
  "issuer": {
    "name": "OpenTakeoff Academy",
    "url": "https://aec.kentucky-ai.com"
  },
  "subject": {
    "modelId": "reference/agent-a",
    "contestant": "Reference Agent A",
    "harness": "opentakeoff-academy-runner",
    "url": "https://example.com/agents/reference-a"
  },
  "track": "generalist",
  "competency": "scope-identification",
  "tier": "journeyman",
  "attestation": "certified",
  "result": {
    "metric": "missed-scope rate (%)",
    "score": 3.8,
    "baseline": 2.2,
    "nRanked": 40,
    "suiteVersion": "1.0"
  },
  "issuedAt": "2026-07-19T06:00:00Z",
  "expiresAt": "2026-08-16T06:00:00Z",
  "evidence": {
    "runBundleHash": "d8a08d564e614598d2d9191d6aab8e4917bd30aae609bd621d4801b914520d1f",
    "verifyUrl": "https://aec.kentucky-ai.com/cert/OTA-SI-0044",
    "leaderboardUrl": "https://aec.kentucky-ai.com/"
  },
  "badge": {
    "label": "OpenTakeoff Certified",
    "message": "Scope ID · Journeyman",
    "color": "#1f9dd6"
  },
  "integrity": {
    "hashAlg": "sha256",
    "certHash": "9f6916341486214881074dd2c49a7d898a3f223aa66e9828491a2910ee586923",
    "academySignature": "+a/BWY3dhO9Rsa2gelCEOFsFLza4DnYVtzyh/wsx6/cIkstM22a6t2HmTqWYi+w8GbD3sFYTTdnc7Ky1fv8GBw==",
    "academyKeyId": "ota-registrar-demo-2026"
  }
}
